asin,title,comment,rate,helpful_votes,review_date,is_verified_purchase,sentimentB00CH9QWOU,BUY THIS MACHINE YOU WILL NOT BE SORRY,rarely write online reviews products buy impressed machine must share people contemplating purchase bottom line extremely good value price would highly recommend machine anyone regardless experience level making espressobased beverages read detail background careful buying products kind price range thus lot research buying especially true something cant truly try buy read reviews product although complaints major theme positive using breville daily almost two months feel understand pros cons well coffee person focus espresso americano lattes never dripcoffee person hardcore starbucks latte guy years talked length baristas years get technical understanding makes great coffee previously owned fully automatic machine saeco machine came time buy new machine felt ready make jump semiautomatic machine lastly come technology background eg apple employee feel good judge design manufacturing user interface etc design extremely well designed product every little detail exterior interior packaging controls front machine thoughtfully done well executed serves intended purpose beginning see high quality product breville spent money matters materials visually appealing well sturdily built kind craftsmanship heft would expect much higher priced machine nice touches like tamper store magnetized hole top machine top surface machine stay warm boiler keep portafilter coffee cup warm creating hidden accessories tray base machine signs top notch designers overall product relatively compact fit size kitchen situation lastly user instructions extremely well done helpful read performance espresso produced extremely consistent changes beans age although pretty small difference water boiler heats quickly drawing shot less minutes hitting power button part time grinding beans controls easy use movable items portafilter steamer wand holding well zero concern long term reliability steamer wand compared previous saeco seems create much richer milk foam important lattes cappuccinos number complaints people reviews difficult get good espresso tell first shot good ever since think people creating wrong impression machine incredibly easy use however critically important read instruction manuals first help ensure get right grind level thing really need set personal preference extent beans seems best thing control hard tamp grounds portafilter tell give good strong press use two hands hard flat surface fine dont overthink machine beans strongly suggest find local shop roasts beans onsite truly fresh beans want espresso whole beans need arabic oily kind otherwise gum grinder cleaning terrific design makes breeze clean water grounds catch tray lifts one piece take everything sink without making mess quick rinse ready put back one thing avoided coffee grinds spill portafilter grinding process may even fall coffee maker onto counter floor shake portafilter mildly grinding even grounds minimize mess even doesnt eliminate completely mess creator tamping grounds levelling dose size cause grounds spilled contain although turn dosing blade upside use scrape grounds counter bowl use catch grounds level dose overall quite minor requires less minutes cleanup day,5,174 people found this helpful,"Reviewed in the United States on April 8, 2015",True,positive
B00CH9QWOU,Maintenance and usability,profile name says first ever review feedback anything bought anywhere online felt like spare time christmas also hope someone find helpful primary criteria choosing espresso machine looks dont read choose machine opinion best looking machine market right hand assessing features keep reading bough machine weeks ago away week work travels used effectively times made around espressos cappuccinos two weeks owned two espresso machines last years half price one understand base line previous knowledge issues first issue around excess amount discharged water bottom tray see breville obviously even made floater flips red overflow issue bottom tray overflowing water using machine times thought strange emptied water continue using machine time monitoring level water bottom tray drinks mostly espressos cappuccinos tray halfway full think right gave breville support call responsive called back explained situation gentlemen spoke said normal operating condition machine enduser expected empty tray due stated events taking place event switch machine automatically drains stale water pipes tray fresh water plastic container used see positive smart function machine confirm much water discharged tray event machine drains certain amount water every espresso made tray order get rid water internal pipes water pressure left machine pipes prolongs life machine confirmed whilst phone much water discharged tray event machine drains certain amount water using steamer eg milk frothing explained excess pressure released pipes well water large amount water released tray tested whilst phone support assessment issue time change empty tray roughly made drinks stress whether water overflow espresso tray consider nonissue normal operating condition listed manual brought consumers attention choosing product obviously known breville since went far designing smart flipping floater turning red tray full however consider much hinderance users next issue number per conversation support normal operating condition steamer pipe blocked use cleaning needle supplied machine followed switching steamer get work frothing milk around cappuccinos made using machine last one yesterday support said may used whole milk think normal operating conditionbest practice listed manual brought consumers attention choosing product obviously known breville since went far supplying cleaning kit machine specifically designed needle obviously seem consider much hinderance users issue number coffee grinder feature usability tell much coffee ground grinder go long keep porta filter baskethandle pressing grinder switch result every coffee make taste different summary returning product since afford time maintain empty water clean although making coffee ritual feel like get use machine would require much attention maintain learn operate also want able use milk type without fear clog steamer pipe lastly coffee tastes differently every time make last one would take time get use machine admittedly allow although coffee lover justify price espresso machine basic issues listed whomever overengineered selfcleaning functionality machine person approved done detriment usability affected end product result end day next section suggestions improve product future breville product owner case ever read light top grinder dispenser see much coffee ground maybe options available users unlimited coffee grinding needs light see well exact amount find better way cleaning machine discharging lot water tray burden enduser see suggestion instead onoff steamer switch knob controlling much steam use help cleaning pipes well stopping excess water discharge tray since user simply release excess steam knob easy onoff switch say impossible grinder dial numbers hard see hope helps,1,305 people found this helpful,"Reviewed in the United States on December 21, 2022",True,positive
B00CH9QWOU,There was a learning curve but now that I got the hang of it I am able to make excellent much better than Starbucks lattes and,update year usage stars issue resolved although took month whole process turned needed decalcify often since using machine daily ie easier calcium harden everytime cleaning pill ive adjusted machine figured make great coffee keep running however still one household produce good cup wife would rather drink instant coffee try learn quirks update stars months steam pressure espresso became poor timing happened christmas family stars functionality stars reliability post another update see customer service resolves issue original review stars ive breville bes xl months learning curve got hang able make excellent much better starbucks lattes decent espressos thought would review mostly give tips new users barista express addition usual pros cons pros coffee taste machine make great coffee end day thats buying right coffee produced much better produced high end automatic machines ive tested breville delonghi unit using beans delonghi automatic produced ok espresso mess quicker breville produced better tasting shot consistently looks sure plastic parts overall unit sturdy aesthetically pleasing price unit cheap affordable lets make high quality espresso stop buying starbucks use machine instead get money back pretty quickly cons tough replicate exact conditions every time explain people may get frustrated relatively steep learning curve people like used semipro machine like compared automatic time consuming make coffee making latte example easily takes minutes busy work compare pressing button walking away tips things watch caught guard beginning get pressure coffee right would need fresh beans throwing year old beans simply work regardless grind settings quantity ground coffee tamping strength settled lavazza super crema espresso decent taste high end ok price freshness lasts bit longer due bean treatment weekend coffee drinker like invest container air tight store coffee beans leave whole week coffee grinder dry pressure making espresso go resulting watery mess make sure grinding enough coffee tamped coffee close machine get quantity start adjusting grind size much space coffee grounds machine way get good pressure invest time researching learning barista techniques pay prepare initial frustration get hang freshness beans matters rarely able get exact pressure beans get stale soak water differently pressure drops accept long pressure range good forget programming option pressure always takes different amount time produce quantity coffee say ml press hold button way coffee jut keep pouring press desired quantity reached stop buy generic cleaning tablets branded ones fraction cost enjoy coffee,4,22 people found this helpful,"Reviewed in the United States on December 15, 2016",True,positive
B00CH9QWOU,READ my review and you will be GLAD you did  no really I put some time into this just for YOU,despite negative criticism sprinkled throughout review keep mind giving machine stars spent weeks getting know intimately love much burglar broke house stole would order another one day back starbucks since said need read review machine frustrate get read coffeeloving friend guy knew nothing espresso machines mechanically inclined dont usually read instructions different machine selfexplanatory need read instructions well written even include troubleshooting section dont get frustrated machine untilunless read instructions standalone purchase machine costs around give take need invest another right start preferably time get enjoy fullest get unreasonably frustrated making lattes mochas things really order time available amazon pack disposable oz cups lids sleeves sold yesfresh trust want get per cup far convenient trying clean million dirty coffee cups caroffice week worth twice cost long run friends need loan nice coffee cup go may never see give paper cup take b oz oz torani syrups sauces pump tops go always sold separately drink thing regular basis like white chocolate peppermint mocha buy oz white chocolate sauce smaller oz bottle c amazon basics cotton washcloth pack grey grey matches espresso machine color doesnt matter trust want nicely folded stack sitting next machine use time make espresso dirty needs washed house people using machine bought two packs make much coffee two packs many house im thinking buying third pack pair single shot size pair double shot size set doublewalled espresso shot glasses buy rounded ones ie cutehom espresso coffee cups pour well drip place side time frustrating buy joyjolt javaah double walled espresso glasses instead youll glad long run youre planning make mostly doubleshot lattesmochas buy set dragon glassware oz espresso cups also doublewalled dont keep fidgeting single shot cups keep right spot coffee dispenser important buy doublewalled glasses two reasons first keeps espresso hot youre steaming milk second keeps burning fingers pouring espresso coffee cup e breville bcb baristastyle coffee knock box trust want right next machine coffee grounds start piling quickly dont want portafilter anywhere near garbage thing must space requirements machine want go take counter space allow least inches counter width accommodate slightly even better picture inch setup room spare making espresso read instructions tips dont include help avoid frustration beans grinding lightly knock top hopper lid like knocking door beans keep feeding grinder sometimes get hung light knock time keeps happening overfill portafilter tamping jam coffee grounds water outlet could possibly damage portafilter locking guide grounds tamped filter cup silver part tamper hidden beneath rim portafilter machine includes tool use accidentally overfill filter cup short youll figure much grind time tool necessary b always want watch pressure gauge making espresso needs dark grey area pressure gauge ideally innear middle grey area brew cycle otherwise making good espresso rather making either watered espresso enough pressure enough espresso rich much pressure two key things affect pressure fineness coffee ground adjustable volume grounds portafilter also adjustable although one two shot size setting found best two shot grinds tamping grounds inbetween singleshot grind grind volume setting th click setting grind fineness setting either play around see gives best results pressure low either coffee ground coarsely tamped tight enough filter filled enough coffee grounds combination anyall things pressure high either coffee ground finely tamped grounds hard tightly combination two c using two singleshot espresso glasses collect doubleshot brew keep eye brew cycle make sure centered espresso dispensed avoided using doubleshot size collection cup making mocha syrupsauce drink premix espresso syrup glass stir thoroughly adding steamed milk e steaming milk art science seriously come naturally youve never worked coffee shop trained steam milk favor watch good short youtube videos proper way steam milk thank taking minutes tube learning proper way steam milk things avoid understanding steaming process allow control amount foam top make big mess f steam milk vent steam wand remove residual water boiler line dont want teaspoons water milk vent line turn steam wait full seconds insert steam wand milk turn steam back hold handle left hand place right hand underneath stainless steel milk steaming cup cup hot right hand touch mean really hot hold keep steam wand start counting along pump sounds like metronome background dit dit dit dit semihot lattemocha keep steam wand milk doubledits dont start counting non longer touch bottom right hand andone two three get equivalent single dits hot still drinkable count doubledits veryhot doubledits anything risk burning milk ruin flavor need toss start finished turn steam remove steam wand milk seconds finishes blowing steam avoid milk sucked back steam line g steam milk vent steam wand remove milk inadvertently got sucked steam wand line prevent making way boiler milk makes way back boiler unit failed vent line use destroy boiler permanently milk cleaned burn next use every cup milk steam future burntmilk smellflavor yuck favor vent steam line religiously use make sure others use machine know ruin dont also goes h bottom tray easy remove empty clean comes apart pieces empty every days use fills despite pouring liquid reason time finish using steam wand hot water dispenser machine autovents line boiler bottom tray sneaky little devil even though dont realize filling little use fun fact hot water dispenser used instant hot water make tea cleaning unfold clean washcloth time make espresso tamp grounds help avoid damagingscratching counter catch spillover grounds always spillover b finished use hot water kitchen sink rinse espresso cups milk steaming cup portafilter filter insert remove filter cup portafilter time clean use another clean washcloth set dry upon c washcloth used make espresso fold half twice square use hot water dispenser machine get one corner square wet hot boiling hot water fold square triangle boiling water corner exposed fold triangle another triangle around steam wand thoroughly clean steam wand take little time firm pressure make sure wand clean dont get nasty milk residue build steam wand keeping things stocked milk family uses milk things cereal baking etc gallon time household time go gallon time household trust others house discover delicious lattesmochas quick hand milk begin disappear quickly house gallon time household people regularly using machine b keep spare box togo cupslids hand open order another one cost prohibitive never want togo cups morning c keep spare bag coffee beans hand also cost prohibitive run beans well theres reason ever run beans keep spare bottle favorite syrupssauces run fun quirks tips keep close eye refill often like every morning water tank back need pull time take cup measuring cup refill gets way reason machine smart like keurig sensor telling water run peril dry water runs particularly good machine pumps b use top quality beans recommend buying lb bags starbucks espresso roast beans whole never preground would spend coffee bar setup use crap beans preground aka fresh coffee use top quality starbucks beans financial interest starbucks prefer something else like petes dutch bros fine make sure youre buying whole bean bags espresso roast doubleshot lattesmochas per day go lb bag beans every weeks c transitioning decaf beans nope easy machine set easy transition transition regular espresso beans decaf beans must unlock bean hopper remove pour regular beans ziplock bag take vacuum cleaner im joking vacuum remaining regular beans grinding gear mechanism replace empty hopper lock place fill decaf beans house never hope enjoyed review helps make awesome lattes mochas,5,"19,539 people found this helpful","Reviewed in the United States on January 27, 2018",True,positive
B00CH9QWOU,Fullfeatured high quality home machine but if I had to do over again,first espresso machine ive ever owned purchased spring like many needed stop going didnt know much home brewing espresso lots breville products thought would good entrylevel machine liked features needed onestop solution would still allow make real espresso stuff shoots pod typically dislike armed nothing instructions came power water beans able brew espresso good enough keep going withdrawal typically delicious appreciably less enjoyable favorite baristas favorite cafes also wasted lot beans process days bumbling around decided start researching get better performance learning lot coffee science along way next months technique results improved ultimately plateaued point felt homebrewed espresso generally better favorite baristas still consistent one day could make perfect shot lovely sweetness velvety texture great espresso little extraction defect next day exact thing would get something uneven extracted good exactly sure variable suspected grind consistency since become practiced everything else obvious issues grinder limited range adjustment get good fineness beans popcorning phenomenon beans bouncing burrs passing popcorned beans ground coarsely beans packed grinder weight beans sitting top also machine hopper encourages store beans thats terrible idea better store beans airtight cannister came nice roaster resealable airtight bags oneway gas valves find beans wellpacked like brewed within two weeks roast coffee trainers say rather last weeks roast date still good peak time brewing days roast back popcorning beans grind differently based upon whether theyre bottom top pile would theoretically render every dose grind prone unevenness defect barista express something nature conical burr grinders craft builders figured buildin flow control including grinder use ill come also flowcontrol thats hacked get slightly better consistency adjusted grinder fine would give espresso grind even feeding one two beans time grind consistent top bottom extraction improved significantly still totally consistent makes grinding labor intensive feed beans one two time makes take x long cant anything else thing learned early adventure cant rely builtin dosing settings grinder forget even dont want go crazy handfeed machine like need get scale measure beans one shot time dosing volume controls machine volumetric control long grinder runs good espresso requires adherence brew recipe known mass beans done weighing could take portafilter weigh machine dispensed grind invariably lead waste months new hobby treated new grinder one youve definitely seen watch coffee videos internet day use grinder instead builtin grinder problems last shots perfectlyextracted meaning channeling dead spots nice even extraction correct pressure levels resulting shot gets sweetness bean little bitter sour flavor wasnt used wrong grinder setting mea culpa oops thats kind consistency im looking tell coffee brewing function machine topnotch group head shower screen thermoblock performs professional level right grind make supremely good espresso machine anything want drink straight make milkdrink make americano hot iced whatever want also controls intuitive build quality high would expect breville maintenance espresso machines high maintenance require regular cleaning decaling breville made snap takes maybe minutes descale every month normal daily usage monthly cleaning cycle simple practically runs also take shower screen make sure hasnt accumulated much grit every days thats necessary go weeks without cleaning still work bit perfectionist may gathered ive talked brewing grinding steaming steaming works fine know commercial prosumer models slightly sophisticated steam wands single thermoblock able brew steam fact steam cycle takes quite wind hobbsons choice steam first wait temperature come back appropriate brewing brew first steam shot goes cold dont make lot milk drinks less important shot cools little makes process slower running steam wand textures milk nicely isnt important feature drink mostly espresso americano rather milk drinks drink mostly milk drinks keep mind machines better wands better ability transition brewing steaming steam knob machine also activates hot water dispenser helpful automatically cuts delivering right amount water make americano two cycles give enough brew quick cup tea dont want wait boil kettle range plus however steam control although rotates volumetric control onoff cant dial less steam opening closing would recommend machine would say recommend breville family recommend particular machine espressobrewing star grinder star happy longer need use knew know would gotten allinone machine could gotten better grinder smaller lowercost breville like infuser larger machine focuses brew steam functions like amazing dual boiler might next machine knew better liked spacesaving costeffectiveness allinone allinone going let chase perfection espresso depending wants needs budget counter space requirements might want look machines breville line great controls fit finish customer support would expect breville arent trying jackofalltrades get machine almost everything get running except water beans recommend accessories mm bottomless portafilter see extraction real time key learning extraction defects drip scale slimprofile kitchen scale measure gram accurately weigh dosage beans grinding also test flow rate mass finished product ensure getting good ratio input output must without seeing extraction without able measure dosage able make anything resembling tasty espresso machine things optional helpful rubber tamp mat protect counter limit mess mm distributor tool quickly easily get nice wellprepared puck hand tool makes easier faster less messy breville distributor tool comes useless mm calibrated tamper know tamp application consistent every time builtin tamper adequate theres nothing wrong useless doesnt give guidance allimportant consistency lots replacement filters cleaning tablets descaler machine deficient doesnt things actually come maintenace tools starter packs cleaning tablets descaler really great complete package great instruction booklet nice packaging would expect great company like breville conclusion many people probably right machine quite perfect grinding function good brewing function bringing quality results hindsight gotten infuser dual boiler separate grinder started achieve really consistently great results able stop using builtin grinder prove good machine brewing dont think possible improve much,4,715 people found this helpful,"Reviewed in the United States on December 6, 2020",True,positive
B0CYM2Y154,Beautiful and fun,fun build partner really enjoy nice calming take turns steps build alone listening music video ill using holiday decor centerpiece table pieces accounted plus little extras box good condition upon arrival instructions easy follow huge tiny either size small cute pot flowers ive really enjoyed sets botanicals collection pretty turn flowery decor without wilting spend time arranging cutting stems still love natural flowers though,5,17 people found this helpful,"Reviewed in the United States on November 23, 2024",True,positive
B0CYM2Y154,Very nice project,girlfriend built got could give flowers would never die surprised see much could adjust leaves flowers overall durable piece set center piece instructions also easy follow looks great big small perfect size think gave extra pieces thats probably sucking putting together,5,8 people found this helpful,"Reviewed in the United States on November 27, 2024",True,positive
