asin,title,comment,rate,helpful_votes,review_date,is_verified_purchase,sentimentB09B8V1LZ3,Terribly flawed setup process,idea amazon made basic device ridiculously difficult set ordered one days ago spent hours trying set consulted internet nothing really worked continually got stuck searching wifi step unsuccessful finding networks tried manually connecting using mobile hotspot restarting router etc etc etc could find signal called customer support hard reset tried things still nothing lady recommended return device order new one got refund returned first unit ordered new one conflicted whether order model try completely different smart speaker ultimately decided give one shot received new unit today plugged guarded hopes issue couldnt find network connect shut bluetooth tried manual connection time list networks came network added network would glitch start tried half dozen times add network still wouldnt show connect tried another hard reset device repeated adding network avail back consulting internet hard reset device followed guide found reddit still didnt work wifi network idea download alexa app tablet use phone hotspot instead wifi read something leave app page reason setup even device falling asleep second two app glitch connection fail hard reset device added device selected echo dot disconnected tablets bluetooth selected manual connection app connected amazon wifi network let search wifi came list didnt include mine manually added hotspot networks name password little loading thing sent back searching wifi page list networks came alas happened hotspot appeared network page clicked feeling though alexa playing tricks failed attempts finally connected hotspot least shred hope somewhere universe tiny frustrating device potential could add personal wifi network instead spend another hour repeatedly fiddling app trying add new network could move hotspot wifi followed steps worked hotspot connection minus hard reset third fourth attempt finally connected unplug move permanent location feet away router outlet router plugged struggling much considered leaving eternity didnt want risk reseting deal connection issues idea relief felt plugged permanent outlet automatically reconnected mess setup process scratch probably wouldve returned dont understand th generation device flawed frankly crappy set process go digging router settings app settings restartedreset device multiple times rebooted router consulted customer support poked around multiple online forums spent hours trying get cursed little orb functioning said working well see holds next weeks much trouble finding wifi first place im curious see itll hold stay connected continue posing issues know move set years lord help,4,23 people found this helpful,"Reviewed in the United States on October 5, 2024",True,negative
B09B2SBHQK,First Echo screen wasnt working correctly this Echo Works Great,second echo works great first echo screen would go totally hard wake point let amazon know one arrived next day still old one trust excellent customer service,5,15 people found this helpful,"Reviewed in the United States on November 28, 2024",True,positive
B09B2SBHQK,Compact Smart and Improved Sound,amazon echo show fantastic little device packs surprising punch size sound quality noticeably improved earlier versions deeper bass clearer audio works well music videos even alarms inch display sharp bright perfect quick glances weather updates recipes video calls without taking much space alexa integration seamless always ive using everything setting timers controlling smart home devices camera shutter privacy thoughtful touch device easy set customize nitpick screen size might feel limiting youre looking larger display streaming detailed visuals also speaker great size quite roomfilling youre expecting full stereo quality overall excellent choice someone looking compact versatile smart display whether nightstand kitchen counter office desk echo show delivers great features sound sleek affordable package,5,6 people found this helpful,"Reviewed in the United States on November 30, 2024",True,positive
B09B2SBHQK,Works great surprising features,first foray technology appreciate interactive screen always clear readable good sound small unit user friendly setup really enjoy handsoff control systems around house lot neat accessories control items would never thought know need,5,2 people found this helpful,"Reviewed in the United States on December 4, 2024",True,positive
B09B2SBHQK,Failed in Less Than One Year BUT Amazozn Tech Support to the Rescue,update original review amazon tech support reached help fix problem increased stars stars still stars device problem somewhere addition believe echo dot screen better device hears better better sound run echo show going zombie mode appears rebooting powering repeating doom loop try following put factory default mode holding mute volume seconds see three dots appear screen enter setup point works setting good get setup process parts repeat cycle power one minute try second step necessary works thanks amazon support original review never pick voice commands well alexa devices sound soso dot far better less year recently failed tries boot shuts cycle continues hoping,4,27 people found this helpful,"Reviewed in the United States on October 20, 2024",True,positive
B09B2SBHQK,A Compact Smart Display with Impressive Sound Quality,ive using amazon echo show rd gen release weeks thoroughly impressed performance echo show always reliable smart display latest version truly steps game especially terms sound quality sound quality one standout features echo show upgraded sound system x bass clearer sound predecessors audio quality surprisingly robust compact device whether im listening music catching news watching videos sound rich immersive perfect smaller rooms like kitchen bedroom want good audio without need larger speaker display design inch screen sharp vibrant making great watching short clips checking weather making video calls compact design fits easily shelf counter charcoal color gives sleek modern look blends well decor screens adaptive brightness nice touch adjusting automatically based rooms lighting smart features alexa integration expected echo device alexa integration seamless voice commands picked easily even across room responses quick accurate use control smart home devices set reminders even follow along recipes new smart display features also make easier see control multiple smart home devices huge plus someone like lot privacy security amazon included physical shutter camera provides peace mind concerned privacy theres also miccamera button easy use effectively disables microphone camera overall performance echo show rd gen fantastic addition smart home setup offers great balance audio quality smart features privacy controls whether youre new smart displays looking upgrade device definitely worth considering small mighty find using expected everything checking calendar watching cooking videos,5,65 people found this helpful,"Reviewed in the United States on August 23, 2024",True,positive
B09B2SBHQK,Impressive booster sounds,top quality materials join unsurpassed elegance classic item amazon works properly even without subscription offers support home daily routines security privacy looks improved especially audio performing looks great size connectivity smart home devices also easy,5,One person found this helpful,"Reviewed in the United States on December 3, 2024",True,positive
B09B2SBHQK,Excellent Deal I guess you get what you pay for,honestly havent opened yet busy hopefully bad luck doesnt get excellent price ive wanted one thanks cyber monday believe price paid awesome fast shipping even black friday cyber monday lets hope works great p l e e read experience update using wks disappointment started hours plugging saturdays ago today dec th update december th major disappointment needs every subscription sun enjoy fully even find phone charge google bot charge glitches lot weeks plugged ive hard boot times amazon music sub forget using play music want support many platforms youtube red bought blink system pun intended cameras echo echo camera sale disappointed games want pay service use fully tier service plans bucks like make tier system something work friendly app echo way adaptive lighting even wake screen brighten bit literally option like come see dark screen prompt give light friendly demeanor google bot personality swearing asked serious local news situation country aware vegas since th dec told sure youre asking google bot gave min break first min horrible situation alma mater latest news sad technology using video calls garbage tech abilities expert level internet call mom husband skipping freezing end mine oh forget adding contacts thats charge otherwise get contacts saves im sad really excited newer technology since ive google bot six years knows echo charges absolute worst find phone really give break speaker good highest go without tingy adjusted mids nothing changes even little ask animal day want keep going shows animal sounds want pay service animal sounds come smooth transition screen screen flips news sadly lagging skipping closing nothing expected speed feet modem connectionfor skipping screens lagging stories news ask whats story video calls useless even worth sale price got even close abilities run whole house garage doors emergency help smoke co thermostat list us longer ive ever seen cant even tell local university updates without faking even kno thinks would roll dice pay subs get electronics make long list things actually work star technology stars personality voice choice stars everything subscription montky cost stars ease use stars quality freezing skipping lagging video play sound ease app use blink app use alexa looks esthetic wise functions like making screen brighter adaptive lighting touching voice prompting cost subs extra gear price monthly cost afraid buy extras add subscription stars pre set even sent email impressed last time free options even things like voices alexa diff prompt names alexa words id use every day ziggy went still certain words say pick listen overall average score stars stars around sincerely disappointed primeamazonamazons customer service update december glitches every day reboot least day gets stuck broken half screen black loops glitch happens every day routine afternoon gets stuck weird clock dont normally see im calling customer service getting replacement garbage returned want refund,1,282 people found this helpful,"Reviewed in the United States on December 8, 2023",True,positive
B09B2SBHQK,Price Friendly,many different alexa devices one current favorite super easy use even easier set using alexa app love able connect different devices doorbell camera outdoor cameras device speakers play music really well display sensitive looks great also many different games able play alexa lot fun,5,24 people found this helpful,"Reviewed in the United States on November 12, 2024",True,positive
B09B2SBHQK,Could be great but has some really annoying issues,first generation echo show kitchen died recently ordered replacement realizing small size standard alarm clock small kitchen rather returning though decided keep bedside table appears made ordered echo show kitchen much better size anyway nightstand nice function clock ask weather news etc morning bluetooth speaker good sound size overall great purchase except got couple really annoying flaws severely limit usefulness ugh amazon really hope youre listening least first fixable simple software update second im sure software problem hardware issue hope least updated next model im probably going return one cant see buying another one recommending people issues get fixed first problem using bluetooth speaker like play music apple music ipad hoping use yes link apple music account directly echo show thats got couple flaws first cant browse tell alexa play second youve got music youve uploaded apple music main apple music library another app entirely far tell way access using echo show bluetooth speaker except pair ipad alexa loudly announce connected connected matts ipad says loudly connected previously start using ipad leaving sit say listening night pick ipad morning glance news even im playing audio make announcement totally unexpected like gives good jump scare disconnect ipad makes loud notification sound saying disconnected matts ipad seem managed least turn im even sure connect disconnect phone dont want super annoying ive tried every way find turn bluetooth announcements cant ive searched internet found lots people complaining issue amazon hasnt fixed suggested turning notifications solution ive tried even going far power cycling echo show make reboot still get bluetooth announcements wont go away first thing needs ill give good rating amazon please away bluetooth announcements least make possible disable honestly id prefer completely disable notifications theres fine grain control notifications either problem thats whatever get rid unnecessary annoying bluetooth announcements theres actually much bigger problem may require hardware update fix autodimming theory like want autodimming feature dont want full brightness night room dark dark goes dim makes readable dark without annoying distraction sleep thats good based performs though assume light sensor controls autodimming front directionally focused doesnt pick ambient light turn bedside lamp happens located behind echo show table doesnt pick still thinks room dark keeps display dim totally unreadable lamp light use bedside lamp lot im bedroom huge problem even overhead light bedside lamp screen bright moment turn overhead light leave bedside lamp goes dark unreadable even im using overhead light even happen stand sit im positioned overhead light echo show unit dims display nearly dim goes dark room bedside lamp still dim enough make significantly harder read basically read screen easily room brightly lit totally dark light directly pointed unit light anywhere becomes unreadable course could fix problem turning autodimming entirely would brightly lit night dont want either right setting either inbetween adjusting sensitivity nothing amazon dont know means need light sensors unit currently maybe one facing back unit well software tweak make less dont even know sensitive something needs done screen cant read isnt useful oh finally minor white power cord blackcharcoal device didnt buy white echo show didnt want white echo show power cord match device way cheapout amazon fix problems ill feel much better echo show happily recommend others bedside device issues though im sorry cant recommend,2,491 people found this helpful,"Reviewed in the United States on July 16, 2023",True,negative
B09B2SBHQK,Helps With Organizing Life  One Drawback,three generally okay wont review alexa device set kind tedious still dont know skills provide otherwise device works fine drawback minus star doesnt really support installing apps traditional sense simply features feature doesnt exist cant install example youtube functionality instead ask alexa go youtube youll get amazon silk opened youtube amazon silk webbrowser youtube tedious use browser small device oh amazon silk hot piece garbage positive side love add things shopping list soon think love control lights remotely tell alexa turn lights come home im away regret purchase expect software improve time,4,One person found this helpful,"Reviewed in the United States on November 25, 2024",True,positive
B0BL8WSCH3,Decent tablet for my toddler during car rides,purchased kids amazon tablet yearold daughter great addition car rides loves games videos available kidfriendly design gives peace mind uses parental controls easy set included case durable enough handle inevitable drops tumbles however tablet little bit slow times especially switching apps loading content dealbreaker something keep mind child tends get impatient overall price features solid tablet young kids keeps daughter entertained go appreciate worryfree warranty case anything happens definitely worth considering youre looking budgetfriendly option toddlers,5,,"Reviewed in the United States on December 12, 2024",True,positive
B0BL8WSCH3,Gets the Job Done,well one didnt realize wouldnt able get youtube kids device although videos tab find literally everything would find youtube kids definitely ideal years old would say dont expect tablet fast ipad slow either needs little patience overall good starter tablet youre considering getting little tablet tablet affordable used tester youre ready upgrade know take care things far good probably keep year upgrade well worth,5,60 people found this helpful,"Reviewed in the United States on November 16, 2024",True,positive
B0BL8WSCH3,Good for starter Tablet,recently purchased tablet child baby size perfect lightweight battery life good comes protective case screen might need screen protector well protected raised edges around fire os amazing runs smoothly doesnt give kids many options could cause damages everything ready use right box concerns os though unwanted apps think removed least allowed removed ive used occasionally web browsing fine though fastest streaming videos playing basic childrens games also fine battery charging time good added gb msd card increase storage space ill putting offline videos content way sideload google play onto tablet,5,20 people found this helpful,"Reviewed in the United States on November 24, 2024",True,positive
B0BL8WSCH3,Good But Very Slow,perfect tablet toddler small easy hold durable said wouldnt recommend much older five extremely slow arrives option setup states hand box accurate im glad figured show toddler arrived percent set purchased disney usage like please note takes time download setup set minutes long time little kid already showed please think hand straight box like stated early setup thing ready upon arrival percent charged screen beautiful big perfect little one set time lockshut add apps want use delete recommend product,4,97 people found this helpful,"Reviewed in the United States on September 20, 2024",True,positive
B0BL8WSCH3,Buy it you wont be disappointed it,amazon fire kids tablet absolute gamechanger recommend son autism absolutely loves itit keeps engaged adfree ageappropriate content appreciate builtin parental controls let customize experience hour battery life lifesaver long trips included year guarantee gives peace mind case accidents blue protective case sturdy kidfriendly gb storage perfect downloading favorite apps shows hands best tablet young kids,5,27 people found this helpful,"Reviewed in the United States on November 23, 2024",True,positive
B0BL8WSCH3,I love the Amazon Fire Tablets,one two years yearold never issues easy use parental controls far better ones apple ipad paying small monthly fee apps purchased tablet unlike ipad pay per app kids run apps like crazy table affordable easy use purchased one yearold road trips works great download movies games cases tablet also durable never cracked damaged,5,22 people found this helpful,"Reviewed in the United States on November 5, 2024",True,positive
B0BL8WSCH3,Perfect for my 5 year old,got year old didnt keep taking phones give responsibility tablet perfect size heavy comes good strong case case drops color case pretty well like adjust big letter buttons came whole year free amazon kids really good deal also got link amazon account make easy set got bucks black friday deal really feel like steal,5,,"Reviewed in the United States on December 6, 2024",True,positive
B0BL8WSCH3,Convenient on the go and durable Limited offline functionality,average stars likely still worth needs son always enjoyed little super simple songs dancing fruit go previously ipad pro bam bino space suit case using purpose size practical neither changing cases also risk entrusting toddler electronic gave time dedicated toddler tablet something cheap useful thought getting pretty good deal purchased fire tablet back october november tablet im kind mad tablet never worth definitely worth im jealous potential purchasers reading review right great tablet good tablet makes great tablet kid id buy sale pros case similar space suit case using ipad enough withstand toddler chucking hard ground height done several times stroller shopping cart im kidding youit bounces tablet stays safe case also easy take put back easy cleaning kickstand also useful versatile also functions handle turn tablet upside hang things kickstand see con sizeweight small lightweight enough go diaper bag toddler carry previously fire tablets function disable touch screen guided access apple device convenient use works kid accidentally interrupt video fondling screen purchase came year free subscription amazon kids makes con little less bad cons operating system sorry im apple snob android tablets stink hard set im new fire tablets pretty tech savvy knew getting worse remembered system clunky slow limited apps mainly prayed would able basics toddler setting things kids account intuitive also aware youll downloading unofficial third party youtube app amazons app store official youtube app heard workaround download go google play dont care enough carry extra steps limitations offline playback cant hotspot cell phone able play videos offline imperative also basic tiers streaming services grant access download feature dont yt premium cheat want download videos ipad achieve video downloader havent luck fire tablet luckily free year amazon kids includes large library kid videos download also download digital video media already purchased amazon account kid likes specific content might good solution amazon one season bumble nums sss videos kid watches stuff repeat hopefully gets older starts enjoy wider variety videos films wont drawback case know previously said case pro mostly pro builtin screen protector like bam bino space suit case didnt think id need one bought one separately safe think included case also pretty thick kickstand material slick hard plastic doesnt always play well tablet mounts sometimes car hit bump tablet fly mount,3,38 people found this helpful,"Reviewed in the United States on November 12, 2024",True,positive
B0BL8WSCH3,Overall good for price but some thoughts,got deal definitely worth price way including case let play games allow certain streaming apps personally liked better kids subscription turned know watches usual movies shows weve allowed much random stuff age opinion pbs thing let surf watch anything wants said download amazon prime kids profile problem travel airplanes streaming app download movies watch downloaded movies switched adult profile able save otherwise connected home internet phone hotspot car airplane rides really area gets inconvenient otherwise case cheap lightweight durable like protection yr free replacement love kids profile aside issue turn store web access although customize home screen icons even though access wish could remove least combine folder sight mind cant move anywhere kids profile adult one dumb design worth especially parent dashboard control access even without kids subscription people mentioned memory issues streaming services downloaded profile movies seasons favorite shows downloaded adult profile still half memory available issues weve isnt sd card use little slow trying click fast issue younger kid whose watching shows playing games,4,19 people found this helpful,"Reviewed in the United States on October 1, 2024",True,positive
B0BL8WSCH3,3 year old granddaughter loves it,got grandkids use supervision grandpa learn works tons free educational videos set grandkids profiles profile tablet home smallest tablets inches grandkids ten inche ones home honest seem notice difference comes cover great cause three granddaughter quite understand thrown tossed sat andor walked fit nicely little backpack,5,,"Reviewed in the United States on December 5, 2024",True,positive
B0009TRBCM,The best coverage,tried many highdollar foundations nothing compare coverage one provides light yet feels like covers imperfections perfectly color match perfect blends easily time favorite,5,3 people found this helpful,"Reviewed in the United States on December 2, 2024",True,positive
B0009TRBCM,You can tell in the picture I love this product,im absolutely thrilled foundation using decade safe say absolute favorite formula perfect skin never experience breakouts provides flawless allday coverage without separation patchiness,5,4 people found this helpful,"Reviewed in the United States on December 2, 2024",True,positive
B0009TRBCM,Excellent color match and coverage Ideal for oily Tzon,oily tzone dry cheeks eyes perfect color match wearing cosmetics foundation good skin type lancme marykay prior also wear primer far favorite foundation worth small pump little goes long way bottle really lasts highly recommend,5,9 people found this helpful,"Reviewed in the United States on October 27, 2024",True,positive
B0009TRBCM,Incredible deal,product comes fully sealed shade ordered would recommend deal running incredible price units unit really goes snatch would encourage foundation using months honestly say best foundation ive ever used blends beautifully flakes build smooth application smooth wear throughout day fade throughout day full coverage light weight foundation expect little paired high quality set spray however doesnt move move,5,6 people found this helpful,"Reviewed in the United States on September 17, 2024",True,positive
B0009TRBCM,Blends well,great product blends well lasts long,5,,"Reviewed in the United States on December 4, 2024",True,positive
