asin,title,comment,rate,helpful_votes,review_date,is_verified_purchase,sentiment
B0CL5KNB9M,PlayStation 5  Digital Edition Fortnite Cobalt Star,recently purchased playstation pro digital edition fortnite cobalt star absolutely incredible consoles performance lightningfast thanks powerful ssd games load seconds k hdr graphics breathtakingly stunning fps capability delivers ultrasmooth gameplay thats treat eyes fortnite cobalt star bundle fantastic bonus exclusive skins ingame content make even fun give special edge game activating code playstation store quick easy dualsense controller takes immersion whole new level adaptive triggers haptic feedback make every gaming moment feel real engaging gamechanger literally ps pro sleek modern design impressively quiet operation packaging secure delivery fast product arrived perfect condition console exceeded expectations youre looking ultimate gaming experience highly recommend playstation pro wont disappointed,5,6 people found this helpful,"Reviewed in the United States on December 7, 2024",True,positive
B0CL5KNB9M,Fives No Jive,longtime playstation fan putting getting ps three following milestones occurred reduction size console reduction price console reduction price games console thought introduction ps slim last fall would spur purchase sony didnt cut price even older ps games still selling finally days play event spring sony knocked consoles price didnt want spiderman cod bundles favorite games decided act four years long time wait play new rc title thoughts ps thats house setup remarkably easy including wirelessly transferring game save information ps take figure turn female voice heralding actions accessibility options ps runs like champ far aware fan noises clouds warm air exhaust spewing dualsense controllers weaker rumble expected turns rumble motors default weak setting controllers microphone enabled turned mike rumble back full force finesse experienced ps dualshock controllers im mistaken precision ds controller actually seems improve game scores new user interface kind mess particular leaving power button home page boneheaded move one first issues new console turn bloody beast wish controller battery gauge home page well brilliant idea making disk drive detachable one problem ps involved machines failure read disks years guessing issue dirty reading head sent console sony fixed came back working perfectly one week assume repair replace removable drive without sending entire console repair ps packs tb memory wondering soon would need add memory currently plenty memory switch back forth number games including ratchet clank rift apart plus several ps including wrc generations far cry resident evil well pinball arcade one good reason wanted disk version ps minimize size game downloads preserve memory audiovideo performance ps play back dvds blurays outstanding happy find excellent bluetooth pdp media controller got ps works ps well yea made feel better spending ps vertical stand instead ps titles finally coming price rift apart latest star wars game example two aaa titles available far affordable putting upgrading ps may time last make move provided catch special promotion say game consoles days numbered say long many us prefer play games sitting couch enveloped booming sound watching dazzling bigscreen tvs long live playstation consoles especially serve machine builtin detachable disk drives also play dvds brs,5,551 people found this helpful,"Reviewed in the United States on June 8, 2024",True,positive
B0CL5KNB9M,PlayStation5 Console Slim Review,playstation console slim fantastic evolution original ps provides originals incredible power performance features smaller sleeker design whether youre fan k gaming ray tracing enjoying nextgen immersive experience ps slim delivers every department toptier choice youre looking powerful futureproof console takes less space doesnt sacrifice quality gamers want best worldshighperformance gaming compact form factor ps slim undoubtedly worth investment,5,94 people found this helpful,"Reviewed in the United States on November 15, 2024",True,positive
B0CL5KNB9M,Compact Sleek and Reliable,ps digital slim worked flawlessly compact design sleek look make far less ordinary compared models opinion clear upgrade highly recommended,5,,"Reviewed in the United States on December 11, 2024",True,positive
B0CL5KNB9M,works great,turn clean shiny fast load thing astros playroom pre installed game problem,5,19 people found this helpful,"Reviewed in the United States on November 29, 2024",True,positive
B0CL5KNB9M,Best gaming experience for me,ps amazing previously disc edition broke unfortunately decided go digital edition convenience im gon na resell disc anymore love charge devices via usbc solid build everything need would definitely recommend,5,2 people found this helpful,"Reviewed in the United States on December 8, 2024",True,positive
B0CL5KNB9M,PS5 Slim,ps works perfect packaged well outter box slightly damaged big deal,5,8 people found this helpful,"Reviewed in the United States on December 5, 2024",True,positive
B0CL5KNB9M,Works great,great price ps works great,5,8 people found this helpful,"Reviewed in the United States on December 4, 2024",True,positive
B0CL5KNB9M,Runs Smooth,issue old digital ps shutting would run bit call duty decided upgrade slim everything came box setup data transfer took bit thats given issue hole box like got dropped crushed must issue delivery services handle box,5,8 people found this helpful,"Reviewed in the United States on December 6, 2024",True,negative
B0CL5KNB9M,Clean new,foreign reviews complaining make laugh bad boy fresh box brand friggin new youre doubts chuck thangs window worries cause legit buy love laugh people arent american lets go god bless muricans,5,,"Reviewed in the United States on December 8, 2024",True,positive
B0CFPJYX7P,Kindle Paperwhite 12th Gen The Ultimate EReader for Every Book Lover,title kindle paperwhite th gen best ereader got better rating th generation kindle paperwhite continues cement place top choice ereaders combining sleek design enhanced functionality userfriendly reading experience notable improvements previous models version ideal avid casual readers display design kindle paperwhite th gen features inch glarefree display makes reading direct sunlight lowlight environments breeze larger screen compared previous models gives room text making reading experience feel like real book warm light adjustable settings welcome addition perfect enjoy reading night without straining eyes plus thin lightweight portablegreat travel cozying home performance smoother faster page turn experience kindle delivers snappier performance predecessors extra speed especially noticeable flipping books browsing kindle store battery life impressive lasting weeks single charge making perfect companion long trips without needing worry recharging waterproofing one standout features ipx waterproof rating allowing comfortably read pool bath without fear damaging device level water resistance gives peace mind readers like take kindle everywhere storage connectivity gb gb options theres plenty space thousands books pdfs audiobooks audiobook lovers appreciate seamless integration audible via bluetooth headphones making easy switch reading listening device also supports wifi versions cellular option download books go user experience features amazons kindle ecosystem continues offer useful features like word wise xray goodreads integration th gen kindle paperwhite also supports kindle unlimited prime reading giving access endless selection books youre avid reader enjoys highlighting taking notes adjusting fonts paperwhites intuitive interface customizable features wont disappoint final thoughts kindle paperwhite th gen solid upgrade previous versions combines elements great ereaderlong battery life glarefree display waterproofing storage optionswith additional performance boosts make reading even enjoyable whether youre reading beach bed night new kindle paperwhite continues goto device readers everywhere,5,119 people found this helpful,"Reviewed in the United States on October 24, 2024",True,positive
B0CFPJYX7P,Sharp and by far the best,version kindle paperwhite far best ive seen date available rasberry aka pink lets start color cute sold color okay nice things device screen images books appear sharper impressed warm light settings favorite mine reading experience much easier eye dark mode win typically use night page turn kindle store experience much faster compared agave paperwhite downloads dont lag great im always shopping new books screen feels relatively lightweight however use case pop socket time many books access fingertips dont worry storage capacity kindles one favorite,5,4 people found this helpful,"Reviewed in the United States on December 11, 2024",True,positive
B0CFPJYX7P,Is it worth upgrading  Unfortunately Yes a very resounding yes,ive kindle since ive probably read books little piece equipment past years convenient piece electronics ive carried travels originally bought kindle replace sony ereader glare sony version made impossible use outside brightly lit rooms upgrading amazons kindle huge game changer ive resistant upgrading kindle past years would kindle still works quite well battery life long sure need reboot every weeks otherwise slow use yes issues connecting wifi every month minor inconveniences didnt seem worth fixing well received new kindle paperwhite yesterday first thought wow lot lighter turned sold lightening fast responsive warmer backlight larger screen significantly improved contrast sharper letters bought first ereader sony turn take landing weve come long way since know ereader small personal electronics dont impact airplane instruments read away nonstop flights youre putting upgrading old kindle money dont wait kindle far superior models made decade ago havent done connect kindle local library essentially unlimited supply free reading material,5,186 people found this helpful,"Reviewed in the United States on November 24, 2024",True,positive
B0CFPJYX7P,Tons of issues including horrible Amazon service,owned every kindle starting got voyage right bat new kindle paperwhite overly yellow screen meaning light significantly yellow white even subtly opaque yellow confirmed across multiple websites including youtube amazon reviews issue new kindles longer support apple computers due new mtp format kindles using means go hassle downloading thirdparty application simple things like update new software sideload fonts leads next issue sideloaded fonts longer properly supported still sideload fonts every time open new book automatically defaults bookerly font even though saved certain font setting extremely annoying next issue longer download transfer book content settings amazon website new kindles want download book purchased amazon eliminated ability amazon service answers regarding needless say returned device stated reasons guess amazon going take days refund money wait days get money back amazon defective unsatisfactory faulty device next time ever purchase another kindle amazon yet new kindles bad bother lets talk aesthetics design seems amazon going backwards hardware voyage released years ago compare sidebyside one would think voyage brand new model aside micro usb voyage sleeker premium look page turn sensors better materials micro etched glass screen instead plastic also curved symmetrical design better feel opposed basic slab like new paperwhite lastly amazon done absolutely nothing improve software still limitations since day one kindles limited margin settings limited font size settings limited linespacing settings lot sideloaded fonts would like use unable theyre either big small slightest increment size adjustment absolutely ridiculous also boldness options thick slightest adjustment font go thin bold total joke give us font sizes options amazon advice im gon na give honest sincere advice regarding new kindles stay away disaster previous kindle paperwhite stick much better new paperwhites defective yellow screens poor quality control font bugs mtp format worth quality control bad buying new kindle like playing lottery likely lose get defective device uneven poor lighting heres rub amazon atrocious return policy industry dont say lightly absolutely despicable return process like couldnt even take return local kohls ups store staples store take day work option amazon gave wait ups driver pick kindle return house insanity talk extreme inconvenience outit took days day initiated return day actually reached bank account get refund days prime member since treat members business nobody absolutely must take chance new kindles means go local electronic department store purchase likely get defective paperwhite least go back store return get money back immediately lastly word caution lot books purchased websites past years havent issues sideloading books onto kindles past year amazon making difficult add sideloaded books onto kindle mean still sideload books via application like calibre send kindle keep kindle airplane mode moment take kindle airplane mode amazon automatically mischievously delete sideloaded books kindle yes heard right amazon delete sideloaded books purchased amazon connect kindle wifi happens automatically prove go kindle hard drive computer see book file longer exists particular book companies amazon going year known issue internet simply google amazon nothing guess want purchase content amazon want competition heed advice lot sideloaded books youre better using another ebook reader kobo onyx,1,252 people found this helpful,"Reviewed in the United States on November 12, 2024",True,negative
B0CFPJYX7P,My Smut Keeper,years last kindle paperwhite sadly time new one easy choice buy another paperwhite didnt need anything fancy went regular model teal color vibrant thing fast especially like lighting features dim add brightness depending natural lighting around lightweight easy use quick upload whatever want connects goodreads account issues favorite thing probably ever im happy purchase,5,4 people found this helpful,"Reviewed in the United States on December 11, 2024",True,positive
B0CFPJYX7P,Perfect little carryalong,im relatively new eink convert bought trickedout kindle scribe exactly two years ago device brand new long story short loved device literally death dropping terrazzo floors several airports worldwide mention myriad spills home forgiving carpet fact loved much th gen scribe went firesale weeks ago bought cheapest version replace original recently nonfunctional unit simply swapping old premium pen basic one clearly loved device enough buy adore ability mark pdfs notetaking capabilities even extra functionality still limited device allows focus reading first dont love never weight heavy point never used couldnt prop something led dropped lot led original unit failing wasnt pretty sturdy mean survived repeated collisions unforgiving surfaces even weathered relatively large liquid spills near despite water resistant use scribe need mark pdfs like im gaming keep character sheets kindle need something display larger printed materials like rpg basic books comics hence new kindle paperwhite gen new device isnt appreciably different scribe except couple important ways reviews dont lie screen contrast higher good light without backlighting looks whiter device much smaller seems touch slimmer also importantly less half heavy means comfortable hold one hand reading without tiring dont need set things prop reduces threat drops im public cover device light hold open like paperback wont overbalance fall hand screen given half size scribe seems refresh much faster also seems load store faster settings menu navigation measurably faster well surprising device newer less functionality one thing detracted star battery life dont use pen scribe unless im actually writing drains battery quickly youre turning pages touchscreen however get exceptional battery life scribe terribly much paperwhite granted im average reader minutes day amateurish use backlight day im running battery least paperwhite dealbreaker means gone days bringing charging cord two week vacation scribe hear lot people make noise format aka paperwhite doesnt extended lip side like oasis make easier hold doesnt buttons well understand personal preference personal preference heck wants another point mechanical failure device goes lot punishment public dont want precious pageturn button breaking ever lets face thats everything touchscreen days yes might clean screen often bother wash hands using precious device really anyway arent exactly dealbreakers another thing thats come even professional reviews people accidentally activating bottom button question need alter grip leverage depress device light thing ive mused paperwhite plain plastic thing doesnt flashy aluminum backside oasis even scribe doesnt look luxe hand honestly durability weight issues ive mentioned plain dont care im public device case anyway im apple person experience evanity dont think kindle fashion accessory rather opposite people judge one harshly going amazon device first place im read probably youre bothering read review took less week paperwhite become favored reading device portability weight utility love tiny thing look forward years carefree comfortable reading without worrying much dropping favorite notetaking device general scratchpad scribe,4,58 people found this helpful,"Reviewed in the United States on November 15, 2024",True,positive
B0CFPJYX7P,Worth the upgrade,ive using paperwhite every day since day got love much reluctant upgrade years battery quality diminished slow loading speed become annoyance figured finally time take plunge new paperwhite slightly larger bigger screen yet feels lighter option adjust warmness backlight awesome feature mention load speed lightening fast impressed new paperwhite happy made upgrade,5,9 people found this helpful,"Reviewed in the United States on December 5, 2024",True,positive
B0CFPJYX7P,THIS OASIS OWNER LOVES THE NEW PAPERWHITE,using oasis daily years battery life good longer famed buttons arent working well anymore either release new kindles lack one physical page turn buttons decided order new paperwhite love encourage oasis owners give try get buttons paperwhite crisp lightweight fast turning pagesi couldnt really ask never glare problem previous kindles cant speak would encourage people use dark mode subject migrainesheadachesi used able read minutes migraine pain would start amazon came dark mode years ago problem went away completelyit also away screen yellow problem others talk even though control warm light slider control people seem nit pick new kindles dont share complaintsi never problem location power button another user complained cant clean screen paperwhite turn pagesridiculous toolbar menu top tap button option disable touchscreentap clean away problem agree nonglare screen seems show fingerprints always wipe phone screen every morning new paperwhite time read many hours day every day many kindles since original opinion continue get better thought maybe would miss page turn buttons new paperwhite turns pages easily quickly dont miss buttonsi hold kindle side one hand small arthritic hands move thumb quarter inch tap side screenit easy quick automatic dont even think think people like complaini love read paperwhite gives superb reading experience highly recommend,5,218 people found this helpful,"Reviewed in the United States on November 4, 2024",True,positive
B0CFPJYX7P,Wondering Why I Waited So Long To Upgrade,kindle works fine every year newer version goes sale convince spend money upgrade since one still works albeit little slowly older age well year decided finally mainly cover falling apart old one figured buy new cover go ahead buy new kindle got mail days ago love mean like moon sliding rainbow love many reasons importantly adventures holds future much brighter going go many places books brand new paperwhite excited ive downloaded lots new books curl blanket cause cold outside use beautiful got pink one decided make uniquely mine bought antique brown fintie cover two colors go well together case perfect highly recommend foldover velcro side keep kindle paperwhite solidly secure wont slip attached photo kindle paperwhites side side see difference size newer one bigger bulky feeling lightning fast super awesome didnt realize slow kindle got one far say favorite thing one dont find much difference lighting previous version maybe comment waterproof claim never ever electronics near water learned kindergarten fyi youre tradein percent discount apply order choose option months free kindle unlimited buy device purchase separately took bit figure percent discount pretty good take sale price plus gift card doesnt seem like much add discount works pretty well great new device discount gift card applied account soon submit tradein request dont wait buy new kindle old one making way mail love highly recommend buying youre thinking happy reading,5,8 people found this helpful,"Reviewed in the United States on December 9, 2024",True,positive
B0CFPJYX7P,A few quirks but still great,preface saying kindle third paperwhite ive also fire regular kindle kindle top beloved possessions however im bit frustrated setup one operator error ive trying download many books time keeps freezing system thats version currently gets stars instead first registered device went smoothly opened library discovered handful books well showing unread partially read even though currently unread books first hoped system would catch prior downloading books onto new kindle content library amazon showed books correctly marked read didnt seem happen manually went marked read fair found errors organizing able fix things still frustration time consuming note check ran update first started kindle two restarts unfreeze kindle probably fault trying download many books plus third one screen suddenly prompted register device already done books already downloaded going much slowly downloading hopefully rest process finally go smoothly one quirk couple books placed collections suddenly showed uncollected folder sure somehow accidentally removed collections dont see though going oh one quirk nearly forgot library showing library books even though long returned also rereturn part process getting kindle ready use im guessing next concern trying download books last night fully charged around midnight checked morning battery charge im hopeful fine said done thought going hour long process well double digits hours work left done ah well im sure done focus reading frustration simply unpleasant memory update forgiven noted issues easier use screen nice sized easier readjust wonderful,4,8 people found this helpful,"Reviewed in the United States on November 28, 2024",True,positive
B0D6VGWTYW,Innovative and Versatile Dyson Airwrap,dyson airwrap gamechanger hairstyling offering innovative design curls waves smooths dries hair air extreme heat super versatile coming several attachments different styles leaves hair feeling smooth damaged using traditional tools sleek design easy use favored want best worlds performance hair health one steep price may accessible many users might find bit learning curve initially minute drawbacks performance quality justify reputation hence strong star rating,5,One person found this helpful,"Reviewed in the United States on December 10, 2024",True,positive
B0D6VGWTYW,Best product,dyson airwrap innovative styling tool revolutionized way think hair styling one impressive features ability curl wave smooth volumize hair without extreme heat traditional styling tools often use gamechanger hair health minimizes damage keeps hair looking vibrant healthy,5,,"Reviewed in the United States on December 11, 2024",True,positive
B0D6VGWTYW,Faulty product  Flashes and not working,bought oct received day via prime shipping bought amazon third party seller freaking product cost nearly including taxes gift partner list minute surprise shocked new airwrap working skeptical reviews stating came used blink clean filter continue work wasnt case us new product worked right away without issues turning device make slight noise two seconds flash tired multiple times turning offon changing plug ports cleaning filter bottom handle letting nothing seems like many people problem return post office quickly hope amazondyson issues giving us full refund decided stay away dyson products quality gone hill,1,134 people found this helpful,"Reviewed in the United States on October 7, 2024",True,positive
B0D6VGWTYW,Ok so,never thought would say worth every penny super expensive man hair look great healthier style last longer use devices inept styling hair made easy get salon quality results found easy learn use device noise level great less noisy hairdryer drys hair dang quick love,5,81 people found this helpful,"Reviewed in the United States on October 13, 2024",True,positive
B0D6VGWTYW,Better than I imagined,thinking dyson providing wrong thought slightly higher quality tool would consolidate replace existing tools upgrading bit totally wrong didnt understand much better engineering would mean heat significantly lower tool airflow controlled makes much faster gentler hair diffuse long hair ten minutes straighten style curl minutes look back every tool like cast iron curling rod using,5,9 people found this helpful,"Reviewed in the United States on December 4, 2024",True,positive
B0D6VGWTYW,10 stars if I could give it,product amazing havent even tried attachments love rocking brush attachment game changer quick hair morning straight smooth love happy also tried shark version motor high pitched ears one still loud highpitched bad,5,6 people found this helpful,"Reviewed in the United States on December 1, 2024",True,positive
