asin,title,comment,rate,helpful_votes,review_date,is_verified_purchase,sentimentB0B1VQ1ZQY,Great productivity device,update ive using fire year got prime day still like lot bit heavy relaxed reading also got fire hd th gen year prime day indeed significantly lighter even thought size difference two fairly small width taller portrait wider screen landscape nice keep using keyboard came bundled get keyboard keyboard awesome wider allows keyboard comfortable touchtype want attached keyboard recommend ive used keyboard extensively really great accidentally touching touch pad occasionally unintentionally change typing location also noticed annoyingly slower rendering icons home screen occasionally icons disappear wait reappear couple seconds dont recall ever seeing regular android device fire os issue apparent slower main reason decided write update sd card issue reviewers mentioned thought others issues set card internal essentially quite like bigger internal space everything including apps dangerous reason longer newer versions android unless zillion apps really need bigger internal space apps really set card portable memory instead apps card media files etc decide types files put safely remove card access another device like laptop thats called portable choose kindle app prime movies etc download card people need expanded memory media makes sense safer also good control gets stored sd card vs internal storage setting card internal isnt reason people issues today first time issue others complained card supposedly unmounted fire asked reformat would bigger problem set internal rather portable shut fire removed card mounted windows windows told problem card scan fix windows showed fine issues trouble copying folders card windows returning card fire still showed screen formatting card im wondering fire tends show screens shut else card somehow marked needing format super weird thing said format portable memory without removing anything doesnt formatting card mean erasing showing blank start fresh going format however fire likes format return original folders need copy back anything working fine apparently would reformatted decided swap using portable internal probably every time unmount eject card get message wont really erase everything reformat unless opt change want use card okay card situation happened probably happened function writing card another function update dismounted thus interrupting write windows fix think card issue almost certainly nothing particular card others comments correct ive using new highquality samsung pro plus card overkill fire tablet sale card issue surfaced trying updates appstore seemed frozen still problem appstore fire good state may good idea reboot occasionally probably hadnt rebooted month also thinking maybe trying update broke normal functionality could biggest suspicion fire os july checked updates even though showed last checking today said tap install update everything froze eventually went back updater said update rather bunch gibberish suggested pieces still downloading broken button installing initially happened able install update rechecked updates showed updates found check button reappeared normal seems fine fact os still shows still shows july today aug get usual message system updated secret undocumented thing old update reinstalled perhaps fire os update update builtin component like apstore thing appstore still seems hung page update apps parts work issue app fdroid install update fine new fire also works fine server appstore im thinking got corrupted interrupted update wont work amazon newer update install top amazon listening please please normal updates let users know update let pick update controlfreak apple want using device trying update shutting remove corrupted card thats asking trouble want plugged keep hands problem amazon devices well okay youre gon na force update whether like please dont want cause lot grief let people control awareness device needs updated guess even minor update seems case kindle fully functional pretends since fully functional quits processes unexpected quits cause corruptionscrashessd card issues otherwise good device truly im still happy love whale background initial review got productivity bundle super pleased needed something take notes classes also touch screen drawing great amazon appstore onenote squid great notes experience matter app use pen paint app tried worked slow blame app since onenote squid fine also fairly new open source app called saber seems great still need experiment one available fdroid im thinking professional reviews web sites got early different version pen harsh criticisms match experience works great nd fire tablet like much better first one fire hd wasnt unhappy old tablet got got sale great price almost never used screen unpleasant stressful look plus device annoyingly slow new tablet pleased screen quality speed good im using pen keyboard truly awesome wasnt sure first whether liked aspect ratioshape tablet actually makes sense longer shape allows nearly fullsized key spacing keyboard causing tablet unnecessarily large heavy would ipads aspect ratio someone said prefer snapin clamshell keyboard available much prefer thinandlight keyboard didnt considered looked pics keyboard super easy fast pull snap keyboard need batteries home real laptops use tablet mostly without keyboard half keyboard case stays protecting back camera giving tablet nice nonslip feel plus use foldout stand dont use lap school home use lap desk dont mind cant put directly lap typing really complaints setup perfect well maybe complain little fire os mostly okay would hate phone fine tablet much improved old fire especially settings like control info put google play previous fire im sure one mean android phone things id like play store like calculator collection bank apps whatnot dont need replicate tablet ive installed fdroid still easily put bunch nice apps linux terminal app termux probably install small linux distro desktop expand usability plus microsoft subscription work nice app tablet critical work apps like zoom teams office outlook already really need tablet oh kindle course think past almost necessary sideload google play amazon appstore critical apps least tablet yea generally great well maintained tons outdated apps dont mad amazon google play store youtube etc google policy google want others take open source piece android build thing top control google penalties amazon couldnt sell media directly regular android kind make separate os tradeoff getting subsidized tablet im poor accept tradeoff especially tablet nice one paid get rid ads every kindle fire value discounts lot aesthetics even tablet pleasure use soooo much less expensive similar setup would apple,5,186 people found this helpful,"Reviewed in the United States on July 23, 2023",True,positive
B0BL5SZ3VV,Perfects for kids,weary cause ive heard mixed reviews work amazingly got one kid one picked extremely quick use everything comes year free subscription amazon kids thought super cool honestly everything think child friendly kids bring theyve downloaded many games need clear storage battery life really good go days without charging theres apps books learning videos etc choose love almost want one self also parents side switch read books download apps get web everything use day use night super cool,5,18 people found this helpful,"Reviewed in the United States on November 10, 2024",True,positive
B0BL5SZ3VV,Love it,really opposed young kids tablets husband lax obviously didnt get way tablet perfect little ones parents given lot flexibility terms safety restrictions enable wifi removed web searching amazon kids membership seems well worth trial plan subscribing tablet get loud keep lower volumejust kids hear wont disturb parents tablet pretty durable cover great job protecting frequent drops heavy handling yo able navigate pretty easily storage capacity serving us wellwe apps several books downloaded havent needed download speed acceptable apps things,5,,"Reviewed in the United States on December 9, 2024",True,positive
B0BL5SZ3VV,2nd purchase,nd time buying mickey mouse tablet bc first one broke bc another child needs traveling purchased first one son going trip vegas needed something entertainment always played cousins love kid features age appropriate ability block certain videos hes allowed watch kids like diana bc shes brat screen size large handle allow carry comfortably hasnt broken even dropped mickey super cute bought one dont fight colors put profiles also switch adult profile shop amazon,5,8 people found this helpful,"Reviewed in the United States on November 14, 2024",True,positive
B0BL5SZ3VV,Battery life is awesome,much done without internet sorts games learning already loaded grandson never runs things another type tablet lucky could get hours battery charge one rarely runs nap time even constantly leaving go play trucks whatever good parental controls doesnt go isnt supposed case tablet tough gets dropped drug across floor stood keeps going easy set well worth price paid,5,9 people found this helpful,"Reviewed in the United States on October 11, 2024",True,positive
B0BL5SZ3VV,Amazon Fire 10 HD Kids Tablet,recently purchased amazon fire hd kids tablet child exceptional experience moment unboxed vibrant inch full hd display captured attention picture quality outstanding making videos games educational apps look incredibly vivid engaging one standout features parental controls parent appreciate ability set screen time limits filter ageappropriate content monitor usage without constantly hovering gives peace mind knowing child exploring digital world safely included oneyear subscription amazon kids treasure trove educational content games books videos tailored specifically kids child loves diverse selection love fun educational durability another key aspect sturdy kidproof case twoyear worryfree guarantee mean dont stress accidental drops spills tablet clearly designed withstand rigors daily use young children performancewise fire hd kids tablet impressively responsive improved processor ensures smooth navigation quick loading times even multiple apps running battery life also commendable easily lasting long car rides extended screen time sessions overall amazon fire hd kids tablet fantastic investment parent looking provide child safe entertaining educational digital device highly recommended,5,55 people found this helpful,"Reviewed in the United States on June 23, 2024",True,positive
B0BL5SZ3VV,Great tablet horrible worry free guarantee,ive order two sets three tablets three kids years first older set kid fire tablets bought ended replace one twice due cracked screen rough kid easy way start process go chat phone service get done got done issues sent refurbished replacement mailed damaged one within certain time avoid charged time without tablet well second set replace one due screen tearing artifacts appearing screen contacted amazon chat going circles idea talking got passed another person offered replace even though past standard warranty acted like favor copy pasted year worry free guarantee policy sent still nothing talked another person finally agreed part kids worry free guarantee new process mail old tablet first find something wrong send replacement week means kid without table shipping time processing time asked option like done past said expedited option would pay fee seemed like scam none described worry free replacement guarantee tablets nice service get repaired good,4,30 people found this helpful,"Reviewed in the United States on November 18, 2024",True,positive
B0BL5SZ3VV,Best kids tablet hands down,amazon kids tablet gives parents much ease easy use plus parent app awesome see download request download put timer kinds stuff plus amazon subscription get kids tablet cheap games choose old child tablet downloads specific apps age never buy another tablet kids customer amazon tablet years cant beat quality even mentioning fact great price kids tablet thats high quality,5,4 people found this helpful,"Reviewed in the United States on November 20, 2024",True,positive
B0BL5SZ3VV,Ideal Tablet for Kids  Bright Durable and ParentFriendly,recently got amazon fire hd kids tablet yearold fantastic tablet combines excellent features great durability making perfect young children bright hd screen hd screen vibrant clear making perfect kids shows educational apps games display bright sharp keeps child engaged entertained adfree content one standout features adfree content ensures childs viewing experience uninterrupted ads significant plus convenience peace mind parental controls parental controls robust userfriendly easily manage child access set screen time limits ensuring tablet use safe balanced option create personalized profiles different family members also nice touch battery life hour battery life impressive lasts long car rides multiple play sessions without needing constant recharging makes perfect travel extended use durability tablet comes durable kidproof case withstand drops rough handling case colorful appealing provides excellent protection accidental damage storage performance gb storage theres plenty space apps games videos tablet performs smoothly handles everything interactive learning apps streaming content without lag disney princess edition disney princess theme hit child preinstalled content featuring beloved characters adds extra layer fun engagement overall amazon fire hd kids tablet top choice young children bright screen adfree content strong parental controls durable design make excellent investment perfect blend functionality fun highly recommend family young kids,5,15 people found this helpful,"Reviewed in the United States on August 26, 2024",True,positive
B0BL5SZ3VV,Educational if you are picky and turn off WiFi,quick tip little kids set download favorite apps turn wifi prevents accessing downloading tons new games lead full hard drive reduced attention spans workaround easy pick choose educational content limited access full review got tablet good price wanted customize year old take grandparents house plenty experience tablets older siblings know easy get addicted garbage apps low quality entertainment setup worried unlimited kids content even set age range years lot videos apps would like restrict think would easy seems go block appbookvideo individually thousands also found way press hold account block apps bulk search keyword block ideal remembered pro tip read research see apps videos library doesnt mean used simply click download ones want turn wifi note found next day wifi connected automatically removed completely airplane mode youll need wifi setup tablet youre safe remove plan enjoying apps set every months remove add new apps manually might seem tedious totally fine get nice variety apps kid thrilled problem see cant screen time timed access share purchased movies require wifi working us loaded apps dr suess content would gladly allow play way better previous attempts give kids tablet ipad amazon kids gives many adfree games amazing toca boca educational apps etc paid lot buy apps ipad fire tablet experience much better designed kids interface locked kids set kids account put nice long password parents dashboard pin kids account size screen great far good tweaks kid friendly access,4,4 people found this helpful,"Reviewed in the United States on November 12, 2024",True,positive
B0BL5SZ3VV,Educational Content Curated to Age,love kids year old bought every single grandchild one storage tend stick content however download kindle books shared library think would like younger ones read older ones read loud ive one kid managed break screen twice replaced questions asked first time within year window replace next one explained gentle costs grandma doesnt replace safe since ive got one grandchild coming one remind parents change age educational material getting appropriate age downside kids account would rather able many want one account pay kid instead account educational content things control account settings child absolutely turn purchase protection grandchildren going ordering stuff otherwise love,4,,"Reviewed in the United States on November 26, 2024",True,positive
B08KVZ6X3P,Great Speaker,tiny speaker packs punch expecting sound comes sounds great great base clear sound fit purse glove box basically anywhere small sturdy feel connects immediately phone turned great value money easy use amazing sound would highly recommend,5,53 people found this helpful,"Reviewed in the United States on October 18, 2024",True,positive
B08KVZ6X3P,So portable so powerful,one greatest product spent past months wife real estate agent need open house every weekend great product carry around play music open house add bit vibes build quality sound quality design really wont regret investing product,5,27 people found this helpful,"Reviewed in the United States on October 17, 2024",True,positive
B08KVZ6X3P,Overall Great for Picnics Small Get Together Family Parties,jbl go compact portable bluetooth speaker delivers impressive sound quality small package sleek modern design go great accessory music lovers go one standout features jbl go portability small size lightweight design speaker easily taken anywhere go whether beach picnic simply around house builtin battery provides hours playtime allowing enjoy music without worrying running power another key feature go bluetooth connectivity allows easily connect smartphone devices wirelessly speaker makes convenient stream music favorite apps playlists ease waterproof dustproof design jbl go makes ideal outdoor use whether youre pool beach hiking mountains rest assured speaker withstand splashes dirt ensuring music keeps playing matter terms sound quality jbl go delivers surprisingly robust audio size jbls signature pro sound expect clear highs crisp mids surprisingly punchy bass sound wellbalanced fills room outdoor space ease making great option small gatherings personal listening overall jbl go reliable versatile portable speaker offers impressive sound quality convenient bluetooth connectivity durable design withstand elements whether youre looking speaker take outdoor adventures simply enjoy music home jbl go solid choice,5,61 people found this helpful,"Reviewed in the United States on June 3, 2024",True,positive
B08KVZ6X3P,Another successful JBL purchase,little nugget one many jbl purchases made years far im disappointed compact great take trips also use hot tub great sound quality charge lasts several hours,5,11 people found this helpful,"Reviewed in the United States on November 26, 2024",True,positive
B08KVZ6X3P,Little Speaker Big Sound,nice portable speaker even bass punch usb c charging port bluetooth greater range higher quality audio charge lasts hours waterproof perfect beach boating pool area anywhere outdoors,5,14 people found this helpful,"Reviewed in the United States on November 10, 2024",True,positive
B08KVZ6X3P,Rich sound and compact size but some superficial durability issues,jbl go compact weatherproof speaker ive used time designed portable fitting easily purse bag making ideal onthego use heres detailed look experience pros super compact portable small size makes perfect travel outdoor adventures even moving around house easily slip bag carried hand weatherproof design ip rating rugged housing ensures dustproof waterproof meaning take beach park pool without worrying exposure elements powerful sound size despite small size jbl go packs impressive punch delivering clear audio surprisingly strong bass one key selling points making perfect personal use small gatherings easy connectivity pairing speaker simple connects automatically saved devices without hassle feature makes highly userfriendly especially switch multiple devices super nice color choices used much older model jbl speaker years ago initially available black company come along way since providing color choices appealing personal experience cons limited volume sound quality great sometimes wish volume could go bit higher especially im listening favorite songs surface vibration issues strong bass impressive causes speaker vibrate excessively leading frequent falls surfaces frustrating especially youre always keeping eye wear tear months light use ive noticed rubber gripper applications surface starting peel considering placed bag couple times wear feels premature might raise concerns longterm durability battery life expert matter compared model similar ones yet simply personal perspective find battery life impressive features battery runs quicker expected meaning requires recharging bit often,4,58 people found this helpful,"Reviewed in the United States on September 16, 2024",True,positive
B08KVZ6X3P,Well worth the money,quite bluetooth speakers years far impressive speaker seen small yet loud sound quality great,5,5 people found this helpful,"Reviewed in the United States on December 4, 2024",True,positive
B08KVZ6X3P,This thing has amazed me,believe much sound little speaker packs ive experienced jbl flip thats got paying attention jbls portable speakers thing sounds good wanted able even portable solution sound something would fit really easily work bag cant play music loud office wanted something better laptop speakers solving issue feel like thing business small sounding good rich clean enough bass make music video sound great use time never get think aw man better sound quality going darn think oh heck yeah get use little guy stay hotel connect laptops bluetooth watch movies really enhances experience completely forget great audio coming tiny little bluetooth speaker get fixed media enjoying charing pairing really easy dont even know long battery lasts ive never die know cant go forever boy seem like go real long time bought boombox nearly half prime day ive tried different models come strange conclusion get impressive smaller get isnt much sacrifice spending less going smaller bigger go less feel impressed turn big boombox think oh man going blow away end think wow sounds really good like little jbl go flip boombox incredible expected im still impressed jbl go need something quick easy much easier remember pack leave packed even im sure outdoor setting something bigger carry boombox definitely ton bass size little go enough bass wiggle around countertop vibration really like rubber pad bottom sit upright stay place also absolutely love make waterproof seem get completely submerged river dont miss beat keep rocking theyre many things right products,5,193 people found this helpful,"Reviewed in the United States on August 12, 2023",True,positive
B08KVZ6X3P,Absolutely the best you can buy for the price,already jbl charge three years wanted little speaker garage ordered actually almost good charge sound extremely clear extremely crisp wan na pump itll get really loud want clear easy listening without spending lot money definitely one order best best price cant say enough good things,5,3 people found this helpful,"Reviewed in the United States on November 26, 2024",True,positive
B08KVZ6X3P,Good BASS,tiny speaker fits palm hand surprised low end would strong defined perfect gift onthego students listening lectures podcasts group doesnt get loud music roomies neighbors id rather exercise speaker home using earphones great addition little family holiday potluck parties fits small purse big sound,5,One person found this helpful,"Reviewed in the United States on November 23, 2024",True,positive
B0BFC7WQ6R,Crisp Sound and Sleek Design,first ever owned echo speaker however design honestly fell love design think modern way incorporates clock speaker well done sound im honestly impressed sound quality loud crisp clear isnt absolute loudest best speaker however performs incredibly well bass good present small device alexa alexa feature amazing versatile responsive well love control many things right accessories screen first glance though whole top portion screen small square center screen bright pleasing look touch screen responsive decently customizable color clock format wish options want clock look like though issue connectivity seamless easy handle phone alexa app many options use echo spot though ive gone ive seen rest things use app versatile im sure wifi connectivity matters comes response time phone echo response time quick experience cord brings decently long cord would nice plug bit less bulky minor inconvenience issue overall solid product highly reccomend youve never one buy things mind though wanted get order fan light bulbs control see wanting get things use echo spot however speaker still great smart speakerclock,5,95 people found this helpful,"Reviewed in the United States on September 6, 2024",True,positive
